recordId,drugName,condition,reviewComment,date,usefulCount,sideEffects,rating
67698,Plan B,Emergency Contraception,"""Please don&#039;t stress over this let the pill do it&#039;s job!! Lost my virginity to my boyfriend although we did use protection at some points we weren&#039;t using a condom and it was dark. So to be sure we got the pill and about a little over a week I finally got my period. I burped a lot but other then that no side effects. So please don&#039;t stress because I&#039;m pretty sure that&#039;s what caused my period to be late (:""",8-Dec-16,0,No Side Effects,5
160175,Buspirone,Anxiety,"""I have been on Buspar for about 2 months now for anxiety from keppra. It seems to work sometime but when I get an anxiety or panic attack it hits hard. I was on 5mg twice a day and now my dose is really high. Like today it seems to have no effect. And I&#039;m always lightheaded dizzy fogged out feeling. And my other doctor said to try Xanax.""",24-Jul-17,13,Extremely Severe Side Effects,5
231993,Trazodone,Insomnia,"""I used to take 300 mg (prescribed) of this and it did nothing for me for sleep.  I took 600 mg (not prescribed that way) and it still did nothing for me.  Now I take 200 mg along with 200 mg of Seroquel and I fall asleep within an hour and wake up refreshed.""",27-Oct-09,17,Mild Side Effects,5
215168,Lubiprostone,"Constipation, Chronic","""Well I started this medicine on Monday and its Thursday and I am extremely sick. My stomach is killing me I sit on the toilet because I feel like I am going to go to the bathroom but nothing ever comes out. I have severe abdominal cramping and cold chills that make it even worse. My chest feels tight and I am so uncomfortable and grouchy because of the pain. This is awful I would not recommend because I was so excited about being able to go to the bathroom and be normal but this has not worked. I am not taking any more of this medication when it is suppose to help with chronic idiopathic constipation and IBS and its made it worse!! So upset I could scream...""",18-Feb-16,35,No Side Effects,5
82730,Maxalt-MLT,Migraine,"""This little wafer gave me life back ! I use to suffer every week ,at least one attack.Not only does this kill the feeling of my brain bursting through my skull but stops the vomiting . Saved my life ,I felt I couldn&#039;t continue my life with such a disabilitating condition.""",12-Nov-16,12,Moderate Side Effects,5
176586,Lorazepam,Anxiety,"""I have been a broken wreck for the last 6 months. My doctor put me on a combination of Celexa (citalopram) and 2 x 0.5 mg lorazepam daily. Been doing that for last 6 months and I&#039;m happy again and actually now getting married. All I know is you live once and this medicine helps me. """,13-Sep-11,14,Extremely Severe Side Effects,5
28214,Lexapro,Depression,"""I&#039;m a 66 y/o female with what I think is &quot;atypical depression&quot;, meaning I am not melancholy and not unduly anxious, but suffer from what I lovingly call &quot;homocidal irritation,&quot; which can escalate to rage pretty easily. Lexapro (10mg) over the past 8-9 yrs has been a lifesafer, as any of my friends will readily corroborate. If I go off for a few days (refill issues), they can tell! However since my mother died 3 yrs ago and ended my 13-year role as caregiver, I have sunk into a very narrow life, with few interests, a morbid aversion to human interaction, and often a complete inability to get out of bed and tend to the simple basics, like eating, showering, and dressing. Have added 20mg of Wellbutrin to the mix, but so far no improvement.""",22-Apr-15,25,Moderate Side Effects,5
175634,Augmentin,Otitis Media,"""I recently started a prescription of Augmentin, and the day after I started the prescription started having issues with an erection (not being able to have one).""",9-Oct-11,9,Mild Side Effects,5
141755,Escitalopram,Bipolar Disorde,"""Lexapro made me feel good. I was able to control lashing out and crying. However, after a week of taking, something triggered me again. A horrible thing happened to me and made me take too much alcohol while on this medication. Messed me up and after that, a symptoms keeps coming up. Lexapro really made me hold on to my sanity but suicidal thoughts came up with the symptoms. """,15-Mar-11,19,Mild Side Effects,3
176785,Nardil,Depression,"""Have been depressed and anxious my whole life (now 44) and was undiagnosed. Was on Paroxetine for 10 years: life continued to turn to crap, wife left me, etc. Psychiatrist listened to symptoms and put me on 3 x 15mg Nardil. Still have suicidal thoughts and trouble with sexual function but it is definitely the medicine for me. Will stay on it for life if possible: at least I am still alive and food restrictions aren&#039;t that bad.""",6-Jan-13,60,Moderate Side Effects,5
145615,Qsymia,Obesity,"""I started Qsymia on 1/21/16 and it was prescribed by my endocrinologist. I&#039;m still taking the starter dose of 3.75/23. I&#039;ve lost 10 lbs in 6 days! I have not been hungry and have had very few cravings. I&#039;ve EASILY maintained a 1200 calorie diet for the past six days and have been exercising by walking (12000 average steps/day). I have one more week left of this dose and then I&#039;ll start the 7.5 mg recommended dose. I&#039;m 5&#039;11, starting weight was 235, current weight 226, and goal weight is 175. I&#039;m so glad that I&#039;ve started this medication.""",27-Jan-16,23,Extremely Severe Side Effects,4
195888,Levomilnacipran,Major Depressive Disorde,"""By the afternoon of the first day I started Fetzima, my lymph nodes were swollen and tender to touch.  It feels like it just keeps getting worse.  I&#039;m now on my 3rd day and have pressure in my face and ear.  I thought it was a cold, but after reading some of the posts, I think it may be related to the Fetzima because I have no other &quot;cold&quot; symptoms.  So, I figured I would share my experience so far it case someone else has experienced the same thing.""",10-Dec-15,21,Mild Side Effects,4
230622,Depo-Provera,Endometriosis,"""I was very unhappy on this drug. My pain was not reduced as it should have been. I spotted for the entire 6 months I was on it. I was extremely depressed, had no libido whatsoever and gained 20 pounds. This did not work well for me for this condition at all. Unfortunately once it is in your system you are stuck with it. It took a full year for my body to readjust once I was off it and to stop spotting. It was also hard to lose that weight afterwards.""",7-Jan-10,67,Extremely Severe Side Effects,5
174758,Dulera,Asthma,"""No asthma systems since using this medicine.""",21-Feb-12,41,No Side Effects,5
171906,Amitiza,"Constipation, Chronic","""I&#039;ve been on Amitiza for about a year, and while it works, it doesn&#039;t work as well as If like it to. I tried the 24 mcg dose at first but it was way too strong, definitely makes you run to the bathroom all day. I then switched to the 8mcg capsules twice a day. If I take them on an empty stomach, I get really nauseated, so I usually take them with a meal. I still had to use Miralax and fiber along with the Amitiza to ensure I stayed regular. Sometimes with all of this, I still got constipated, so I would take a 24mcg dosage and deal with the aftermath. When I did have a BM with Amitiza, it wasn&#039;t a &quot;complete &quot; one. It would make me poop out water, but it felt like the bulk of the stool was still left inside. I stopped taking it.""",5-Aug-17,10,No Side Effects,5
224658,Bupropion,Bipolar Disorde,"""I&#039;m giving this two stars because it helped me quit smoking, but that&#039;s all it did.  I&#039;ve been taking for almost two months now and my anxiety has greatly intensified.  I also have muscle aches in my legs and back - not sure if it&#039;s related to the bupropion, but I didn&#039;t have these feelings before I started taking it.  It did not help me lose weight, but I did finally plateau after gaining consistently on Paxil and Abilify.  I&#039;m still taking Abilify so maybe that&#039;s interfering with weight loss, I&#039;m not sure.   Also my depression was under control for awhile but with the relentless anxiety about everything, it&#039;s creeping back in.  Everything feels like an effort and all I want to do is stay in bed all day.  This medication is not for me.""",13-Jul-17,1,No Side Effects,3
197853,Metoprolol,Migraine Prevention,"""I had a neck fusion 10 years ago from an auto accident.  Then hit my head on a cabinet and crushed my surgical site and herniated 2 more discs.  I&#039;m much better now 10 years later but with a high stress day, I get muscle spasms in my neck and horrible headaches.  I&#039;ve been sick for 3 days with neck pain and headache, with nausea.  I&#039;ve been on pain pill, Tramadol, muscle relaxer, Skelaxin, and Zofran for nausea, and ice packs and heat to my neck.  Nothing working!   I took my first Metoprolol 50mg this morning and my headache is gone!  No side effects from the metoprolol.   I consider it my miracle drug.

I&#039;m a cardiac nurse and hand out metoprolol all day for cardiac conditions.  Who knew it was for migraine/headaches?!.""",25-Sep-17,4,Severe Side Effects,2
136772,Sodium hyaluronate,Osteoarthritis,"""After years of increasing pain I finally decided to try Euflexxa. Why did I wait so long?? After first injection I had absolutely NO pain, no swelling, no adverse reactions of any kind. I&#039;ve just completed my third injection and still no pain. I now know what it is like to walk without pain. Relief!""",17-Jul-14,122,No Side Effects,1
221782,Dexlansoprazole,Barrett's Esophagus,"""I&#039;ve had severe heartburn since I was a teen.  Tried everything from Tums, Rolaids, Zantac, Prilosec, Prevacid, etc.  Prilosec was the only drug that seemed to work, but I had to keep increasing the dosage.  My doctor recommended Kapidex and what a difference!  I take one pill each morning and haven&#039;t had heartburn since.  It&#039;s been almost a year now so I won&#039;t find out if it has improved Barrett&#039;s for another month or so, but at least the heartburn is long gone.  I can actually eat anything now, jalepeno&#039;s, pizza, etc. without getting heartburn.  Now I just worry about the long term negative side effects on bone density.  I do take a calcium supplement every morning as well just in case.""",26-May-10,8,Moderate Side Effects,5
163983,Fluorouracil,Basal Cell Carcinoma,"""My doctor found what he thought might be burgeoning skin cancer on my bald head. First time, he &#039;burned&#039; them off with whatever he sprayed on my head. Next visit (way later on) he said the spots hadn&#039;t gone away. He prescribed &quot;Carac&quot; (fluorouracil) if I could afford it. Over $400/tube! But my insurance paid up to the $20 I had to pay, so I went for it. Four weeks of dabbing this stuff on my head, and the pre-cancerous spots are gone. During the treatment my head got all scabby and red. Had to buy some cheapo pillow cases because I would end up bleeding on them at night. I guess the scabs got rubbed off as I tossed and turned.  Anyway, I&#039;m totally satisfied with the outcome and would recommend this cream to anyone who can afford it.""",26-Feb-14,65,Mild Side Effects,5
145881,Qsymia,Obesity,"""I am a 31 yr. Old woman and I&#039;m on day 12 of the 14 day starter dose. I&#039;m 5&#039;8&quot; and I started at 304.6lbs. Today I weigh 290.4lbs and I have lost 2 inches in my waist. I have high blood pressure and and my left leg is held together by screws so I can only do light to moderate exercise. I&#039;m eating 1700-1800 Cal a day and drinking lots and lots of water. In my opinion, Qsymia is so far so good and very expensive. You pay for what you get.""",19-May-13,51,Moderate Side Effects,5
71728,Tramadol,Anxiety,"""I have been feeling very unhappy for a long time and its a struggle getting by every day. However I took 100 mg of tramadol for some chest pain once and it is like a light bulb was switched on inside me. My social anxiety is also less. However I am worried about taking it more often as I work in a sensitive field where your judgement can be called to question at any time""",2-Feb-17,27,No Side Effects,5
201717,Zoloft,Depression,"""I have been on Zoloft for the past two months now, and last week went up to 100 mg from 50mg. No real great dramatic feelings of elation and euphoria. I would honestly say though that it has diminished my depression quite a bit, and I am not quite as troubled by my regrets, which really bring me down as well as the living situation I am in now.
I have been struggling with suicidal thoughts for the last six months and go back and forth between wanting to just end my existence, to realizing I don&#039;t want to end my life; I just want a higher quality of life.""",10-Jun-13,104,Severe Side Effects,5
185670,Saxenda,Obesity,"""I have been taking saxenda for 3 weeks now. Just started 2.4 dosage yesterday. So far I have lost 12 lbs. I have also been working out for an hour 4 times a week. No major side effects until yesterday when I change dosage. The injection site is very painful today.. This never happen until yesterday.. Overall I think this drug works!! ( I forgot to inject it one day and I was really hungry)""",21-Sep-16,21,Mild Side Effects,5
160847,Buspirone,Anxiety,"""I have post traumatic stress disorder. Buspirone was added to my Effexor to calm me me down when I began experiencing rages.  It worked well.""",6-Jul-09,4,Extremely Severe Side Effects,3
63902,Sertraline,Obsessive Compulsive Disorde,"""Hi, I&#039;ve been struggling with anxiety disorders since age 17, specifically with OCD. I&#039;m 31 right now, decided to give sertraline a try, by myself, I&#039;m on it since March this year, that is like five months, honestly since first day I felt like a switch in my brain, three weeks later and made an appointment with a psychiatrist, because I thought it would be better if a doctor prescribe it to me instead of self medicating. I supposed he would increase my dosage to 100 mg but he said to stay with 50 and it is still working well with that. He also added me Modafinil, Trifluoperazine and Clobazam and doing fine with that combo, I&#039;m gonna review them later. They aren&#039;t miracle, they give you tools for you to keep going well with a good mindset.""",14-Aug-17,2,Severe Side Effects,5
163693,Mirtazapine,Not Listed / Othe,"""Great medicine this. I have just started it due to insomnia and manic depression also impulsive behavior and serious anxiety. It works very well with hardly any serious side effects. I&#039;m so glad because like many others on here I have tried EVERYTHING but its never quite hit the spot. This medicine does it all and I think life may start to have some normality to it. Watch this space.""",29-Jan-13,28,No Side Effects,5
222261,Nicorette,Smoking Cessation,"""After 30  years of less than a pack a day I tried this gum (the patch, cold turkey, worked for a period of time) and I have to say it works well in that it eliminates the desire, quickly.  I have limited my use to six pieces a day and I generally have the urge when I would normally take a break at work - really seems to take the craving away and I&#039;m getting a lot more work done, for sure!  Stick with it - I&#039;m about to wean off (hopefully) using regular sugar-free gum as a substitute.  Good luck!""",8-Nov-11,28,Severe Side Effects,5
14450,Buprenorphine / naloxone,Opiate Dependence,"""I have found Suboxone to be my savior. Got me off the opiates both prescribed and street drugs in the opiate family.""",2-Nov-09,15,Extremely Severe Side Effects,5
222979,Topamax,Migraine Prevention,"""I took Topamax for a month. It helped with my headaches very little and the side effects were terrible. My feet and hands would go numb several times a day. My short term memory was completely gone. I had a hard time finding the words to speak especially in the evenings. And the very worse was the depression and anger.""",24-Feb-11,11,Severe Side Effects,2
81335,Yaz,Menstrual Disorders,"""Before I started yaz, my periods were ridiculously heavy and the cramps that came with them were even more horrific. I&#039;ve been on yaz for 8 years now, and I still love it! I have not had a cramp in 8 years and my period is REGULAR! 

My only downside is this: Several years ago studies started to show a slight increase in women getting gallbladder disease. I started yaz in December 2007 at the age of 21. By march (approx 3 mo. later), I had severe pain in my right side just under my breast. Turns out, I needed it (my gallbladder) removed. I am healthy and have never even been sick in my Life.  I&#039;m convinced it was due to to the yaz, as nothing else in my life was different. Easy surgery/recovery though, and no problems since! Just watch out!""",27-Nov-15,7,No Side Effects,4
201607,Zoloft,Depression,"""I had Social Anxiety, and depression and some OCD thoughts, but on Zoloft after the first day taking it I had a clear mind, and I feel free and in control of my life. Some side effects though mild for me was feeling tired on the first day only, and not being able to fall asleep at night, but overall no side effects over here. But I am only on Day 2.""",13-Nov-13,65,No Side Effects,5
1295,Sumatriptan,Cluster Headaches,"""Sumatriptan nasal spray 
15 years sufferer 35 y old only got sumatriptan lately and it&#039;s working well headaches would last 90 mins to 3 hrs now with the nasal spray 20 mins and its completely gone don&#039;t leave home without it now""",28-Sep-15,0,No Side Effects,4
185536,Saxenda,Obesity,"""I&#039;m a 44 yr. old female,  175lbs, and 5&#039;4&quot;. This is my second round of saxenda. I took in when it was first released with a good amount of success. Due to a change in our insurance, I had to stop for a year. Now I&#039;m back on again, 3 weeks in and I&#039;m dialed up to 1.8 and my start weight initially was 186. I&#039;m now 175. Has anyone had the extreme vomiting and head to toe sweating with upper abdominal pain? This seems to happen whenever I&#039;ve had bread or candy. What kind of meal plans are other people doing? It&#039;s really hard to find information regarding literally what to eat. Anyone??? Thanks in advance!!!""",1-Apr-17,21,Extremely Severe Side Effects,4
151978,Chantix,Smoking Cessation,"""I&#039;ve waited for one year smoke free to write this review.  Chantix absolutely works.  It turned me into a suicidal mess for a couple of weeks but it worked.  I was a pack a day smoker since the age of 16 and had tried multiple times to stop.  I tried Wellbutrin, the patch, and anti-anxiety medications but they didn&#039;t work.  Stopping for a week or so was easy.  Staying quit is what I couldn&#039;t do.  That is until Chantix.  It doesn&#039;t seem possible that a year has already passed since I stopped smoking.  However, I feel as though I&#039;ve never smoked at all.  I have absolutely no desire to smoke. I pushed through it and am proud to say I no longer smoke!""",3-Aug-11,23,Moderate Side Effects,5
95976,Sertraline,Anxiety and Stress,"""Last night was my first night I experienced nausea and dry mouth and a feeling sensation like something was in my throat before I went to sleep. I woke up 5 hours later and I felt like I was going I have an attack because I wasn&#039;t sure what I was feeling was normal but I didn&#039;t have an attack. Normally I would but not this time and I do feel shaky but I see a lot of other people had the same effects. Seems okay so far, I just hope it helps with my anxiety for the most part I suffer from bad anxiety.""",2-May-13,44,Severe Side Effects,5
156876,Ibrutinib,Chronic Lymphocytic Leukemia,"""Due to my having a variant GI system (with its own side-effects), my oncologist, in an abundance of caution, started me on Imbruvica 1 capsule in the AM, daily. Literally within days, the SIGNIFICANTLY large lymphs in the front and rear of my neck, disappeared. WOW! 
MY WBC&#039;s skyrocketed, but that is typically expected due to the mechanisms by which Imbruvica works. Oversimplifying here -- the abnormal (cancerous) cells, congregate in the lymphs. Imbruvica forces those abnormal cells out into the bloodstream, where they can be attacked and starved of the BTK protein, which they need to thrive and propagate. The &quot;dead&quot; abnormal cells are then flushed out of the body.
After 2 months dose upped to 2 capsules daily, and still tolerating well.""",17-Dec-16,16,Mild Side Effects,5
28511,Lexapro,Anxiety,"""Gained about forty pounds, became more depressed, slept all night and half the day, was always tired, getting off of it was horrible. I had headaches weird feelings like I wasn&#039;t even there, weird pains.""",13-Feb-13,26,Mild Side Effects,3
94330,Trintellix,Depression,"""I&#039;ve been on Brintellix for 4  months now.  It is providing a mild antidepressant/anti-anxiety effect, but definitely not robust enough for my lifelong generalized anxiety disorder and depression.  I&#039;d give a 3.5/10.  It&#039;s better for me than Viibryd (the medicine it most closely resembles), but I&#039;m still in a state of deep dysfunction.  On the positive side, the side effects have been minimal, the most prominent being some decrease in sexual desire and sexual pleasure.  (Not really an issue for me though since my anxiety and depression pretty much have a corner on that non-existent aspect of my life).  Also, even with my decent insurance, and Takeda&#039;s &quot;discount card,&quot; the cost for a month&#039;s supply of 30mg a day (the dose I&#039;m taking) is about $300.  Not affordable.""",24-Jul-14,84,Extremely Severe Side Effects,5
204583,BuSpar,Panic Disorde,"""I wish BuSpar was the solution I was looking for to help control panic attacks but it wasn&#039;t for me!
After 10 years of taking Zoloft (an SSRI) which worked to help control panic attacks, I decided to consult my doctor to see if there was an alternative drug safe for pregnant or nursing mommas. He recommended BuSpar and I so wanted it to work but not only did my panic attacks come back in full force, but I also had muscle weakness and these weird &quot;zaps&quot; in my head/ears.""",8-Jun-10,37,Mild Side Effects,5
49828,Gabapentin,Anxiety,"""This is a miracle drug as far as I&#039;m concerned. I have struggled with depression, addiction and bipolar disorder most of my life. Until Gabapentin I was not living a full life most of the time. Since Gabapentin I have more confidence, energy and able to deal with stress so much better. I also sleep like a baby most of the time. I can&#039;t say enough good things about this drug.  It has given me hope and taken away that terrible feeling we all struggle with.""",1-Jul-16,122,Mild Side Effects,3
46056,Phendimetrazine,Obesity,"""I had gained a bit of weight during Menopause (about 20 lbs.) I am 5&#039;3&quot; and I now weigh 140lbs. I did get down to 135lbs but have gained back a couple of pounds.  I wanted to share my experience to see if anyone else noticed the same. I went to Medi Weight Loss Clinic where I was given this medicine for only a few weeks because I wasn&#039;t that overweight.  What I noticed was the increase of energy, that I had lost after menopause, I also lost all hot flashes, night sweats, and irritability.  After not taking the medicine for a couple of weeks all menopause symptoms came back. My friend had the same happen to her.  I think it would be a great for menopause.""",23-Jan-12,86,No Side Effects,5
10521,Spironolactone,Alopecia,"""No impact""",15-May-15,26,Moderate Side Effects,5
147728,Norethindrone,Birth Control,"""I started taking Jolivette 5 months ago. First, to all you breastfeeding moms out there, I have had NO decrease in milk supply. And that from a woman who had to supplement with first 2 babies within their first 3 months because of low supply and low weight gain. My 3rd baby is now 5 1/2 months old and still exclusively breastfed and gaining weight beautifully. So it doesn&#039;t always affect milk supply.  I&#039;ve taken different BC pills before and always suffered severe anxiety and depression just before starting my period. I was worried about starting another pill but haven&#039;t had any problems yet. My first month on these pills I had a heavy period, but haven&#039;t had another one since. I&#039;m pretty happy with these pills""",3-Nov-17,1,Mild Side Effects,5
191329,Lisdexamfetamine,ADHD,"""I fell like kill myself after a week of taking this drug, very depressed, can&#039;t do anything. Stopped yesterday. Wast of money!""",2-Oct-16,7,No Side Effects,1
160651,Buspirone,Panic Disorde,"""I took the wrong dosage of a different medicine (forgot which) it never did help me with my anxiety attacks. I went to my doctor about it and he recommended buspirone. I tried it for 2 weeks and it helped me a lot and I was happy but when I stopped automatically, I was upset all the time. I got back on it and I was happy again. Buspar has helped me a lot.""",2-Jul-13,40,No Side Effects,5
27480,Requip,Restless Legs Syndrome,"""I have been taking Requip XL for a few years now.  It worked great at first, but now I get rebound restless legs syndrome almost every afternoon.  I also find that if I&#039;m late taking it, or if I take it after the rebound RLS starts, that it takes hours before it helps.  I usually end up taking Percocet to stop the painful twitching.  It&#039;s better than taking nothing at all, but I would love to go 24 hours without the pain!""",5-Jul-11,24,Extremely Severe Side Effects,1
