recordId,drugName,condition,reviewComment,date,usefulCount,sideEffects,rating
141024,Escitalopram,Anxiety,"""I was put on this for my panic disorder  because i was suffering from panic attacks  while driving because of a bad car wreck I had. Anyways my doctor put me on 10mgs when I took it in the day I was so drowsy and out of it I couldn&#039;t function. So I switched to taking it before bed and I would wake up every night with dizzy spells and heart beating out my chest. It would take a hour for those symptoms to go away and for me to continue my sleep. Then during the day I would have extreme anxiety I couldn&#039;t be behind the wheel of a car without panicking, I couldn&#039;t go out to the store without panicking I was only on it for 10 days the worst 10 days of my life and honestly I feel better now that I&#039;m off this horrible drug""",1-Dec-15,18,Mild Side Effects,5
194795,Levetiracetam,Epilepsy,"""Keppra was fine for me at first (500 mg twice a day) for 2 months. I suffer from complex partial seizures and experienced a grand mal recently. Then I experienced extreme tiredness, confusion, headaches, greatly increased my depression, could barely go from my bedroom to the living room (never mind managing leaving my house). I had to go back to my neurologist to get switched off such a horrible drug for me. Aptiom (once a day!) so far is a better choice for me.""",4-Apr-17,8,Mild Side Effects,5
115477,Propofol,Anesthesia,"""Drug worked great, but I always lose lots of hair after use by anaesthesia. Happened several times some hair comes back not all.""",29-Jul-15,2,Severe Side Effects,5
42771,Xulane,Birth Control,"""I have been on xulane for 3 months now and I love it. Before I started my periods were bad with headaches, cramping, and heavy flow, after the first month my periods dwindled and now I only need light pads, I rarely cramp and have maybe one headache. However I do get some redness and irritation on my skin, trouble with the patch adhering to my skin and also my eating habits have changed dramatically, sometimes I&#039;ll be starving and when I see what I&#039;m about to eat I lose any urge to eat. I would recommend it but be sure you remain aware of your body.""",13-Jul-17,10,Moderate Side Effects,5
210727,Mirtazapine,Anxiety,"""Mirtazapine is a miracle, but you have to take a SMALL dose, meaning about 7.5 mg to 15 mg, no more than that.  Larger doses cause too much adrenaline release, so if you gave up on Mirt before, try it again with a pill splitter at a very small dose, just before bedtime.

It will help you sleep, and it has virtually the opposite side effects of SSRIs, meaning no sexual side effects, and no anxiety increase (only decrease).  I take it for debilitating anxiety just as I described.""",9-Feb-17,100,No Side Effects,5
72082,Tramadol,Chronic Pain,"""Suffer from fibromyalgia,two bulging disc, sciatica,restless leg syndrome. It usually takes me an hour or two to function in the morning. Have been on tramadol since it first became available.will continue to use this amazing medicine as long as my Dr prescribes it.""",19-Mar-15,29,No Side Effects,5
62422,Citalopram,Depression,"""I have been dealing with anxiety and depression for a few years. Got prescribed Xanax and Celexa. I was doing really well taking the Xanax but as soon as I would take the Celexa I started getting really sick. Real bad migraines, dizziness, fever with sweating. I am now being switched to Paxil, hopefully it will work for me.""",13-Dec-11,9,Mild Side Effects,4
41856,Clonidine,ADHD,"""My son is 6 years old and was diagnosed with ADHD, ODD, Aspergers syndrome, and possible bipolar disorder. We have tried so many medications, Ritalin, Adderall, Focalin XR, Risperadal, Seroquel, and regular Clonidine. He is now taking 300 mg of Trazadone which doesn&#039;t help, 15 mg of Abilify, and Kapvay. I&#039;ve spaced the three medications out but he still wakes up at 9 am and goes to bed at 3 am. I am at a loss right now because the psychiatrist says he&#039;s limited as to what he can put him on but the Trazadone I swear seems to wire him up. He&#039;s wide awake as I am writing this post. The Kapvay does make him cranky and irritable during the afternoon, any advice please.""",29-Jun-15,20,Severe Side Effects,1
132419,Ativan,Anxiety,"""Truly a life saver. I take 1.0mg on an as needed basis. I like it that it doesn&#039;t give me a hang over and it is short acting for me- usually lasts 4 hours. Klonopin works the same but is longer lasting and a little stronger.""",2-Jun-09,38,Mild Side Effects,3
169489,Stelara,Psoriasis,"""Stelara is a life saver.  I have psoriasis for over 30 years. I have tried creams, PUVA, Vit A meds, Fumiderm, Otezla nothing has worked. My last med Otezla didn&#039;t work for me and made things much worse. I had my first Stelara injection on May 7 2016. After about 10 days I could feel an improvement. After 4 weeks there was a dramatic improvement and I was almost clear.  It is 9 weeks since my second injection and my life has changed in so many ways for the better thanks to this medicine.  There is a slight redness where some of the patches were but the dermatologist assures me these will fade. I have no side affects whatsoever. Thank you for this life changing medicine and for restoring my self esteem after all this time""",24-Jul-16,39,Moderate Side Effects,4
41860,Clonidine,Opiate Withdrawal,"""I been on norco everyday for 10 years, was on 10-12 pills per day for chronic pain. Without clonidine I would be hurting like hell.  I went to detox at the hospital &amp; left after 14 hours, they wanted me on Suboxone, which is good but its just another high to kick after, been there done that, I don&#039;t need a migraine headache as well. Suboxone causes headaches &amp; Suboxone is hell to get off. Best bet is to stick with clonidine pills. 1st day 01mg x5 2nd day x4 3rd x3 4th x2 5th x1, your 6th day can be 1, or none, you decide. The only withdrawal symptoms I have from norco is minor diarrhea, minor pain in stomach, no eating for days, hard to get to sleep but its possible...and day 1 i had depression, but I&#039;m over it now....LIFE SAVER""",6-Jun-15,193,Moderate Side Effects,5
174276,Betamethasone / calcipotriene,Psoriasis,"""I tried other medicine that did not work and costed me over $100.00. I tried the Taclonex liquid in a bottle for my scalp and applied to my legs. My scalp cleared in a week, my legs are coming along very well. The dark patches have completely vanished. When I went back to my doctor he was very impressed and so was I. I asked for a prescription for the ointment for my legs and use the other on my scalp on a as need basic. My doctor office also gave me the prescription card, I&#039;m able to get 6 bottles of liquid for my scalp and 6 ointments for my legs.""",2-Dec-12,12,Mild Side Effects,4
34169,Tramadol,Pain,"""Ultram was prescribed for me for low back pain of unknown origin.  Unfortunately, I would say that the medicine only knocks the pain level 2 points on the 10 point scale. It allowed me to function, but did not take the pain away.""",20-May-09,26,Moderate Side Effects,4
118053,Apixaban,Not Listed / Othe,"""Was on warfarin for 20 years. Have had major complications from it. Got changed to clexane injections twice a day. ( yay no INR monitoring ). 
But  was recently changed over to apixaban. Zero side effects changing over.. but I&#039;m a few months in now and OMG the hair loss is crazy.""",27-Apr-17,5,Moderate Side Effects,5
171144,Methylnaltrexone,"Constipation, Drug Induced","""I&#039;ve been on hydromorphone 2 mg (Q 4 H), oxycodone/APAP 10/325 mg (Q 4-6 H), and OxyContin 40 mg daily for an accidental amputation. After landing myself in the hospital for diabetes related illnesses, my doctors became concerned about me not having a bowel movement. They used Relistor as a last resort, and although it didn&#039;t work immediately, it worked the next day. I&#039;ve been going nonstop since!""",7-Dec-15,16,No Side Effects,5
227820,Etonogestrel,Birth Control,"""Implanon is EXTREMELY effective. I have had it 3 years, I&#039;ve never had any of those weird mood swings. Nor have I gained an abnormal amount of weight. I do have a period, but its only 3 days a month.""",24-Oct-11,0,Mild Side Effects,5
30942,Miconazole,Vaginal Yeast Infection,"""I think this product m3 works different for every person I just inserted m3 about 20mins ago mild burning with itching. Nothing excruciating. Will update later""",15-Feb-17,5,Severe Side Effects,5
197257,Paroxetine,Premenstrual Dysphoric Disorde,"""I was prescribed Paxil 10mg for Premenstrual Dysphoric Disorder. I&#039;ve been taking it for two weeks and I feel so much better! It also helps with my social anxiety as well. I feel calmer, centered and more assertive. It makes me less emotional and somewhat experience &quot;flat effect&quot; which could be bad in certain situations. In first two days I felt very nauseated and couldn&#039;t eat and lost 5 pounds however I noticed my appetite has increased and I&#039;m watching my weight! So far so good.
(Note: SSRI&#039;s works differently on pre-menstrual women and improvements is seems in the very first cycle at least in my case).""",18-Jun-13,21,Mild Side Effects,5
226111,Remicade,"Crohn's Disease, Maintenance","""I have had Crohn&#039;s Disease for 18 years. I was extremely ill for the first 8 years. My doctor put me on Methotrexate, and I got better, but not &quot;well&quot;. Then, Remicade came out. I have been getting infusions every 8 weeks for over 7 years, and it has saved my life. I will say, though, that at one time they hoped to wean me off of the Methotrexate, but I started having flare-ups and the time between infusions was increased. Since I am back on the Methotrexate and Remicade, I have had no problems at all. Yes, I know my immune system is very weak, but I avoid anyone who is sick, and try to get enough rest when I can. This combination of drugs has worked for me and I hope I have helped someone out there! You may need something else with Remicade. """,18-Aug-09,67,Moderate Side Effects,5
147941,Norethindrone,Birth Control,"""I have been in this mini pill about 2 months now. I must say it has really been a challenge for me. So week one I waited until my period was over to start the pack. 2 days later I started my period all over again. Which I was told. It&#039;s called breakthrough bleeding. So that went on for 3 more days. Started week 2 of my pack on Tuesday. I started all over again. 3 days bleeding. 3rd week same thing Famous Tuesday same thing. But I kept on taking the pill I was told my body has to get used to it. 4th week to my surprise no show Tuesday of that week. I was excited. Started the new pack .And Famous Tuesday all over again. This time I guess this was my regular period. And I have been on my period for over a week maybe I need something else.""",14-Dec-16,5,Mild Side Effects,5
93558,Famotidine,,"""Don&#039;t take too much and don&#039;t smoke cigarettes while using, both will make you sick.""",22-Apr-10,14,Severe Side Effects,5
190149,Protonix,GERD,"""Worked great for GERD. After a while of being on it, it doesn&#039;t seem to work that well. I am on 40 mg&#039;s/day and now have a stomach ulcer? """,13-Dec-09,37,Mild Side Effects,5
198326,Exenatide,"Diabetes, Type 2","""My wife started a course of Bydureon in the summer. After 3 months she had not only lost weight but her A1C went from 9  6.something. She felt healthier and had no severe reaction. I went on it when I saw how it worked for her. It affects your appetite and you can avoid junk food without and compulsion to eat it. No problems at all except for constipation. I&#039;ve lost 20+ pounds in three months and have gone down a few inched on the waistline. Very expensive drug with a month&#039;s supply being over $1600 but my insurance covered it for both of us.""",17-Nov-15,28,Mild Side Effects,2
129223,Levonorgestrel,Emergency Contraception,"""I took Plan B One Step 7 hours after intercourse (pull-out method,no bc) on day 12 of my cycle (usually ovulate day 14-16, sometimes earlier). The first 24hours following I was very warm, dizzy and extremely tired. I stayed very tired for the following week. About one week after taking the pill, I had breast tenderness and some slight cramps from time to time for about a week. This made me concerned I was pregnant. I took two HPTs... One 10 days following intercourse/pill and the other 12 days later, both negative. Period started 13 days following the pill (5 days earlier than expected). It is heavy and dark and I am relieved.""",4-Oct-15,12,Severe Side Effects,5
88885,Tenuate,Obesity,"""I have been taking 25 mg Tenuate for almost 3 weeks and I am gradually losing weight. So far lost 8 lbs. My physician prescribed a water pill. I am definitely watching what I eat and making better food choices when I do eat, i.e. low in fat and lots of veggies.  I have absolutely no side effects and I can easily sleep at night. So far so good.""",15-Apr-09,45,Moderate Side Effects,5
56596,Elavil,Depression,"""Unable to urinate.""",13-Dec-13,40,No Side Effects,5
64544,Sertraline,Anxiety and Stress,"""My family Doc put me on sertraline due to anxiety. For some unknown reason, I developed driving anxiety. I also had PSD. Initially, it was suppose to be a 9mos treatment. 25mg for 3 mos. After the 3mos, the dose was increased to 50mg. It worked great in reference to my PSD but there was only a 10% improvement on my driving anxiety. Right before the 9mos, I had some difficult family situations where I ended up self increasing the dose to 100mg. Eventually, i saw my Doctor in my nxt folllow up and he wasnt happy with me for increasing the dose...but ended up on prescribing the dose at 100mg. Now I have been on sertraline for 2 years and a few months and I feel that my driving anxiety is coming back and even worse.""",24-Mar-16,11,Moderate Side Effects,2
134212,Prednisone,Asthma,"""I was put on Prednisone (20mg) twice a day for 7 days after an asthma attack. It made a world of difference for me. I noticed a difference in a matter of a few hours. The only side effects I had were euphoria, insomnia, and severe body aches after the course ended. I&#039;d rather deal with the side effects than not be able to breathe.""",17-Nov-15,53,Extremely Severe Side Effects,5
7238,Aluminum chloride hexahydrate,Hyperhidrosis,"""I have been using Drysol for close to 16 years now... I love it.  My story is very similar to several I have read on this site.  I had a terrible problem with underarm sweat - to the point of putting wash cloths under my arms.  It was so bad I could not wear sweaters in the winter because I would soak them.  When I started using Drysol I had the typical itching and burning for a few weeks.  The more I have used it the less the problem.  Now, I only itch if I get too far out from under my arm pit and put the solution on skin not used to it.  When I first started using Drysol I was an every other day user.  Now, in the winter I can go 6 to 8 days.  In the summer I go 3 to 4 days - I live in Atlanta, GA and we reach 98 yesterday.""",5-Aug-10,22,Moderate Side Effects,5
164230,Xiidra,Dry Eye Disease,"""I had an eye test and found that my vision was much worse.  While waiting for my new lenses she gave me Xiidra eye drops and a coupon, plus some Systane eye drops that I used just over a month (33 days). After a month of Xiitra/Systane my vision changed drastically. She ran another eye exam and showed me the difference of both exams. My last exam was perfect compared to a month ago which was unrecognizable letters. The best insurance offered my wife as an RN won&#039;t cover Xiitra. That&#039;s $500+ a month to you and me.""",15-Apr-17,12,Moderate Side Effects,5
123476,Actemra,Rheumatoid Arthritis,"""I was diagnosed with rheumatoid arthritis in 2008. I was put on methotrexate almost immediately. My first stab at a TNF inhibitor went well for about a year. Then, there were a couple of tries with different meds (including the dreaded prednisone for flares). My PA thought that we could &quot;do better&quot;.....so, I researched and she researched....together, we came up with Actemra.  The stiffness in the morning is GONE!  I haven&#039;t flared in over a year!  I&#039;m SO lucky to have found Actemra.
The only thing that kind of bugs me, is that the week before my next infusion is due, I get a little stiff and more tired than usual.""",28-Mar-13,144,Moderate Side Effects,5
47767,Adapalene,Acne,"""I&#039;m 18 years old, and I was put on exactly 4 weeks ago. I have hormonal acne, and I thought it wasn&#039;t that bad before but I wanted the little bumps off of my face. Now, 4 weeks in, I don&#039;t want to leave the house. I expected the first week to burn and break out and even the second week, but now that I&#039;m on week 4, my skin is red, broken out still, and nothing is going away or healing. Don&#039;t take this. It hasn&#039;t worked for me at all.""",12-Oct-16,9,Moderate Side Effects,4
206443,Trilafon,Bipolar Disorde,"""I have been on Trilafon for 2 years now. Mostly I liked it at first because it brought me back to earth when I was over anxious. I have lowered my dosage since then and I thought it was doing me well, but I have been having neck problems lately and have realized that this is a side effect of Trilafon called extra-pyramidal syndrome that damages my posture area, so no matter how hard I try I can&#039;t regain a good posture. """,26-Jul-11,29,Mild Side Effects,3
150612,Sulfamethoxazole / trimethoprim,Bacterial Infection,"""I have a small either cyst or some type of mass on back of neck under skin. Doctor said it could be due to some type of staph. He prescribed me Bactrim aka as sulfameth.trimethoprim. He said two weeks to take this and if it does not go away we will need to Lance it. Which in a way I&#039;m glad, it bothers me. Anyways I went to pharmacy to get my medicine and went home.  I actually started the same day taking my pill. Friday Saturday and Sunday I felt ok. But come Monday about 3 am I got up and had diarrhea, multiple times I felt nauseous &amp; achey . 7 am I felt it in my throat I vomited  and after that I had a horrible headache. Can&#039;t eat, I feel as though my joints are stiff.  Doc is changing my meds. No sulpha again !""",23-Nov-15,8,Severe Side Effects,5
194087,Gildess Fe 1.5 / 30,Acne,"""I love gildess! I&#039;ve been on spironolactone and two topicals and then later solodyn for acne. I had good results, but I finally decided to try this. I have only had one pimple since taking gildess, and it was minor. I&#039;m so glad I started this medication! I have had sort of weird periods since I&#039;ve started it is the only downside, but I&#039;m on month three and the doctor said that can happen for the first three months anyway. I highly recommend gildess! I&#039;m a 25 year old female who has been struggling with acne for at least 12 years, and I&#039;ve tried other birth controls for acne as well.""",15-Apr-16,2,Moderate Side Effects,4
33993,Junel Fe 1 / 20,Birth Control,"""I have been taking birth control for 10  years due to surgery at a young age. I can honestly say that Junel almost ruined my life. I became completely depressed on this medication, but blamed that on the fact that I just moved 1,000 miles from home and I was homesick. Then I started to realize that there was a pattern. I&#039;d get extremely anxious and depressed for a few days and then it would subside (somewhat) for a week or two. It got to the point where my anxiety was so bad I could barely breathe and making it through a day seemed impossible. I talked to my gynecologist and had my pill changed. I am a completely different person now and thankfully got off of this medication before it claimed my life.""",13-Jul-15,11,Mild Side Effects,5
224873,Bupropion,Depression,"""I&#039;ve only been on bupropion for 3 weeks. It&#039;s 150xl. I haven&#039;t noticed any appetite suppression per say..it&#039;s easier to &quot;say no&quot; to myself but it&#039;s me choosing. So, maybe I guess *shrug* I have noticed that it begins to wear off around 5pm-6pm when I take it in the morning. It&#039;s a notable difference at that point. I&#039;m going to ask about upping the dose. 

Also, a side effect I&#039;ve noticed: I&#039;M LOSING MY HAIR!! by the damn fist full each time I shower..it&#039;s thinning in the front. But I love how I feel, so I&#039;m not sure what to do. If that shows how poorly I felt. I&#039;d rather lose hair than feel the way I did. Maybe I&#039;ll ask what can be done..""",3-Oct-16,6,Mild Side Effects,4
134102,Prednisone,Inflammatory Bowel Disease,"""Age 9 told had IBM ulcerative colitis.  Was put on prednisone for 1 year, went I to remission. Was told may have to have colon removed by age 18year old. And would more likely end up with most side affects. Have had stomach troubles through out the years. Age 19 my thyroid died. Was told it&#039;s like batteries drained of all juice. Started taking thyroid med. Weight up and down for years. Now age 38 years old, past few years more weight gain. And skin ulcers. My testarone levels have been bad. Had to do the shots for this. But mood swings where horrible.  Having so much trouble with my levels and thyroid. What else can I do and is most of this true side affects. Also very high blood pressure, started after a bad accident which had blood clout""",11-May-17,1,Moderate Side Effects,5
151531,Chantix,Smoking Cessation,"""Read the product Warnings.  If you have an auto-immune disease pay attention to side effects, specifically a flu-like feeling at 3 weeks after starting Chantix, then followed by mouth ulcers.  Get immediate medical attention if these appear.  On day 21-22 I felt terrible, just like I had the flu.  On day 24 I noticed several Aphthous Ulcers (something I had never had before).  These progressed to a level that I had to go to the ER on day 26.  On day 25 I discontinued Chantix and on day 38 I am still being treated for this. This response has been repeatedly associated with Chantix and some other drugs as well.  Pay attention to side effects and any unusual symptoms.""",22-Mar-16,17,Mild Side Effects,5
40927,Acetaminophen / oxycodone,Pain,"""In the last 6 months I have had 2 total knee replacement surgeries. My left knee first, right knee 3.6 months later. It is a very painful - actually excruciatingly painful surgery. I have found that Percocet 10/325 is the most effective for pain relief after the first 2-3 days, depending on the hospital stay. Doctor&#039;s are skittish about prescribing Percocet &amp; want to prescribe Vicodin which I can&#039;t take because it makes me hyper. I have had problems with some generic oxycodone 10/325 however but the brand is too costly. Sometimes pharmacies don&#039;t - won&#039;t carry the 10/325 at all and they are restricted to a monthly quota as well so at the end of the month it can be hard - to fill the Rx. Wrong for legitimate pain pts.""",7-Jul-16,5,Mild Side Effects,5
200300,Varenicline,Smoking Cessation,"""I started smoking August 28 1983, tried to quit several times. Took Chantix for 3 weeks haven&#039;t had the thought or care for a smoke since February 14 2014.""",20-Oct-14,32,No Side Effects,5
64915,Sertraline,Depression,"""I got put on this medication about 3 days ago and my first time taking it was in the morning. There are two side effects I&#039;ve had, the first day taking it I felt kinda nauseous and I threw up, but after that I was completely fine! I also have had a decreased appetite, but in my opinion that&#039;s a good thing, considering I want to lose a bit of weight. I was suffering for major depression, and got put on this medicine because I was caught in the middle of attempting suicide. But since I&#039;ve started this, I haven&#039;t had a single suicidal thought! I would definitely recommend this. Although ive been on it for just a few days, I already discover improvement.""",31-Mar-15,80,No Side Effects,5
142074,Escitalopram,Depression,"""Have battled depression off and on for several years. Lexapro has proven to be extremely effective for depression and anxiety although requiring a 20 mg dosage.  Minimal side effects as well.""",8-May-08,32,Moderate Side Effects,5
116566,Nadolol,Migraine Prevention,"""I have had migraines for the last 10 years. At first Excedrin Migraine worked, but when it stopped working, I took sumatriptan 100mg instead. In the last 2-3 years, I was getting migraines up to 14 days a month so I saw a neurologist for a preventative medication. I first tried nortriptyline which did not work. Then I tried nadolol 20 mg/day and ramped up to 40mg/day. Within the first few weeks of being on it, migraine frequency and severity was reduced. I have been on 40 mg/day for 4 months now and have only had about one headache per month. I also have a head tremor which has reduced slightly. I feel a bit lightheaded at times, but that side effect is minor. Wish I would have tried nadolol years ago. Migraines don&#039;t run my life anymore.""",24-Aug-16,13,Mild Side Effects,5
89771,Chorionic gonadotropin (hcg),Ovulation Induction,"""Alongside almost daily ultrasounds, it was the only medicine which allowed me a full term pregnancy. The same as Profasi or other HCG meds.""",13-Sep-15,1,No Side Effects,4
