recordId,drugName,condition,reviewComment,date,usefulCount,sideEffects,rating
219597,Microgestin Fe 1.5 / 30,Birth Control,"""I was on Microgestin Fe 1/20 for three months prior to this, I switched because I was getting my period every two weeks. So I switched and I&#039;m so glad I did. Period is completely regulated out again like it was before I started birth control. No weight gain (actually weight loss), no mood swings, no change in libido. Worst parts of this were feeling nauseous for the first three days I was on it (nausea went away after), one pimple, and cramps the first day of my period. Overall, the pros outweigh the cons by miles, so I would recommend this to anyone!""",10-Sep-17,1,Severe Side Effects,5
134044,Prednisone,Cluster Headaches,"""Have had clusters for 45 years, remember the first one. Ergotamine inhaler worked almost instantaneously but gave me a nasty depression. I take prednisone 2(10mg) at breakfast , 1(10mg) at dinner. Tried taking less and headaches come back with a vengeance! They mess with my digestive tract some , and sharp increase in appetite, and an increase in sexual desire. It is not supposed to do that. I will stay on this medication till the cluster cycle ends""",29-Aug-17,0,Moderate Side Effects,5
68176,Plan B,Emergency Contraception,"""On June 6th 2015 I took plan B 4 HOURS after unprotected sex....on June 19th my blood work came back positive for pregnancy...I contacted plan B and now there sending me all these letters to contact them for more questions.....Plan B failed me....even after 4 hours it didn&#039;t work...I&#039;m looking into any other women this has happening to....I think packaging needs to be changed""",6-Jul-15,13,Mild Side Effects,5
200538,Varenicline,Smoking Cessation,"""I tried Chantix for a period of 2 months.  My cravings for a cigarette eased until I cut down to about 3 per day.  The nausea lasted for about 20 minutes after each dose and got better over time.  The vivid dreams, constipation, and gas got worse. I understand this medication is not going to work the same for everyone. I believe there is a short window of opportunity when you either quit or you don&#039;t. When I was down to 3 per day, I probably should have quit.  This medicine began to make me agitated, anxious and very hard to get along with, to say the least. I still smoke unfortunately. """,7-Jul-11,7,Mild Side Effects,5
46409,Modafinil,Narcolepsy,"""I was diagnosed with Sleep Apnea, for that I got a CPAP. But I also had trouble with zombie episodes and uncontrollable sleepiness  (at work, while driving, very scary). I was diagnosed with Narcolepsy several years ago (not formally tested though). I have all the symptoms (night terrors, sleep paralysis.), but I have not been tested for it. Anyway, my Sleep Doctor put me on it primarily because of several driving issues. It seems to work well, I have not dozed off or had a zombie episode since I have been on it. I still feel tired, and I can sleep if I want to, so I feel a little more in control. I also don&#039;t feel like a speed freak, like Adderal.  I am on 200 mg in the morning for the past 2 weeks. So far I am pleased with it.""",1-Oct-09,11,Moderate Side Effects,5
212846,Sofosbuvir / velpatasvir,Hepatitis C,"""I&#039;ve had Hep c for 42 years, Unknown to me.
Had an occular migraine and ended up in hospital to find I had low platelets. Which led to hep c diagnosis
First month sick as can be nausea, headache, fatigue  and insomnia. But after 4 weeeks no hep c detected!
I&#039;m almost done my second month and symptoms wax and wane-mostly nausea and fatigue.
Hoping that after the next month my results are still perfect and that I am cured.

""",5-Apr-17,21,No Side Effects,5
220008,Amitriptyline,Pain,"""Have been taking for over 1 week now  fibromyalgia pain, I am sleeping much better and my pain is 1/2 what it was. I was told to give it 2 weeks but  I felt better after one day of using it""",26-May-16,86,Mild Side Effects,5
210425,Linzess,"Constipation, Chronic","""I just started taking Linzess 145 mg. My doctor gave me samples to try. The first few days I didn&#039;t notice anything, by the third day I finally cleared out my intestines, which was after almost a month of not having a real bowel motion.  I actually stopped taking the medication for a few days because I was concerned I wouldn&#039;t be able to go anywhere, then started again today.  In about 30-45 minutes I was in the bathroom.  I&#039;m not sure if I have to take it everyday or if I can skip a few days in between.  I will ask my doctor.  So far so good.  Anything that helps me go is a miracle.  I&#039;m happy with once every several days especially because I am used to going every couple of weeks.""",18-Dec-13,76,Mild Side Effects,5
86573,Invokana,"Diabetes, Type 2","""I started 100mg in November 2014 and my fasting glucose dropped from 140 to 113, (though it often drops within normal range) A1C only dropped from 7.8 to 7.3, I dropped 17 pounds without exercising and my appetite has diminished a great deal. My Dr. increased me to 300mg in hopes of getting my A1C in normal rage. Also my Dr. gave me a discount card that covers 100% of cost for the first year; you can get that discount by signing up on Invokana.com as well. """,2-Mar-15,46,Mild Side Effects,2
117477,Nortriptyline,Irritable Bowel Syndrome,"""This medicine has changed my life. I went a solid 10+ years living in pain and with constant diarrhea. My life revolved around going to the bathroom. I started taking nortryptaline and after a few days the pain subsided. Then, after a few months and increasing to a max dose of 40mg I now have NORMAL bowel movements. This medicine is a miracle. It also prevents my migraines which were occurring up to several times a month. I only experienced side effects of dry mouth, fatigue, and brain fog for the first couple months. I now have no negative effects. Thank you Nortryptaline for giving me a normal life.""",21-Oct-16,21,Severe Side Effects,5
147393,Alprazolam,Anxiety,"""Great medicine for anxiety.""",23-Feb-11,1,Mild Side Effects,3
199477,Depo-Provera,Abnormal Uterine Bleeding,"""I am a user of the birth control shot and I honestly love the fact that I do not have to worry about taking the pill. I just go to the doc every three months to renew my shot. But the only thing I hate is the bleeding for long periods. I have been on theshot for almost a year and a half. I remember the first three months, I experienced excruciating pain one day in my stomach, it felt so bad. I was in class and I had to run to the bathroom. When I was sitting on the toilet, this HUGE blood clot came out. It was almost the size of a tennis ball. Afterwards, my cramping stopped.""",1-Mar-15,8,Mild Side Effects,2
218488,Tri-Sprintec,Birth Control,"""Tri sprintec makes me sick every single day, like throwing up constantly unless I eat a lot. That is the downside. Upside: It cleared my acne like in 2 days and helped me lose weight, overall a good medicine for acne, maybe not for a birth control?""",29-Jun-17,0,Mild Side Effects,5
93148,Vortioxetine,Major Depressive Disorde,"""For the first 5 days I was excessively happy, I felt like I had finally found a medicine that was really going to work for me though the cost was a concern, my Dr was helping out with samples to see how it affected me as I am also ADHD, have an anxiety disorder, PTSD and other medical issues. On day 6 my face started tingling. Then I noticed that things didn&#039;t taste right like coffee no longer had flavor, soda tasted funny and so on. Later that day I was trying to talk to my dad and I kept losing words, my speech was very impaired and I felt so itchy all over like fire ants were biting me. I called my Dr who told me to stop it immediately. I stopped and my depression has worsened, my anxiety is worse and my speech is still impaired.""",17-Dec-15,32,Severe Side Effects,4
151925,Chantix,Smoking Cessation,"""DAY 8 - sore throat and minor headache. Had quit day planned for day 8 but had some craving and smoked 3 cigarettes. Still very proud of myself and have pushed quit day back a couple of days... still hopeful.""",15-Nov-11,2,Severe Side Effects,5
36836,Fentanyl,Pain,"""Finally after many years of increased pain from osteoarthritis a renowned pain clinic prescribed the duragesic patch. It was far more effective than any other medication. """,9-Aug-08,72,Mild Side Effects,5
2718,Diltiazem,High Blood Pressure,"""This medication when dispensed as Cartia was very effective.  Recently, my pharmacy started substituting from other sources.  (I guess they are saving a 10th of a cent per pill) and I am having negative reactions. Facial swelling, itching and rash on face and neck.  I have stopped using the medicine. """,21-Nov-09,29,Moderate Side Effects,1
83854,Ethinyl estradiol / norgestimate,Birth Control,"""So I&#039;ve been on sprintec for about a year, I&#039;m 19 yrs old about 5&#039;9&quot;. I&#039;m pretty sure this pill is what has made my life  hard for MONTHS. I wake up many mornings and vomit continuously, and have the worst stomach pain of my life. The throwing up usually goes away in the afternoon, but sometimes I&#039;ll throw up at night or feel terrible randomly. I&#039;ve gotten cameras down my stomach, blood work done on about everything, and everything has came back NORMAL. For some reason my doctors never suggested the fact that it might be sprintec, but as of today I&#039;m going to stop taking. Also, since I&#039;ve been throwing up, and have no appetite, my stomach has shrank and I&#039;ve lost about 20 pnds in 2 months, meaning I&#039;m no longer a healthy weight.""",13-Nov-17,1,Moderate Side Effects,5
130261,Levonorgestrel,Emergency Contraception,"""I took Plan B like 2 years ago and about a week after taking the pill I got my period. I have to emphasis that I took the pill within 3 hours of having unprotected sex. However in October 2013 we had unprotected sex and waited 48 hrs to take the pill.  I never got my period and I ended up getting pregnant even though I took the pill.  Like I said this pill works but the sooner you take the more likely it will work.""",18-Feb-14,24,Moderate Side Effects,5
165669,Levonorgestrel,Emergency Contraception,"""To all stressed out girls reading this: I was you until today. I had sex with my bf two weeks ago but he pulled out. I freaked out a day after, after doing some web research. We got levonorgestrel (we don&#039;t have Plan B here) 30 hours later. During these excruciating two weeks, I convinced myself I was pregnant because I did the one thing we all know we shouldn&#039;t do but we do anyways: web research. I invented pregnancy symptoms or really noticed those of PMS I had never ever paid attention to before, and it was horrible. I cried every night, I prayed every second. My period was late, and though I knew it might&#039;ve been a side effect, I was beginning to lose hope (the step after you panic). BUT IT WORKED. I got what should be my period today!!""",20-Apr-17,4,Mild Side Effects,5
104147,Ethinyl estradiol / levonorgestrel,Birth Control,"""I&#039;ve taken Levora, since I was 18, and am now 30. Not once have I noticed any issues except for a slight decrease in my sex drive. No weight gain, no cramps, very little mood swings(but that can be said for all, including men) my period lasts about three days and they are extremely light- to the point it can go unnoticed. I&#039;ve also had unprotected sex for 11 years with the same man, and not once have I been pregnant, or even a close call. My period arrives at exactly the same time every month like clock work. It makes me feel like a normal human being. I might  have one day prior to staring my period, in which I feel a little funky; but it sure beats the alternative! I&#039;d never switch, and if you&#039;re unsatisfied, try it!""",23-Jun-13,31,Moderate Side Effects,5
105055,Next Choice,Emergency Contraception,"""I had unprotected sex three days before ovulation, and took this within four hours after having sex. After reading some of the reviews, I was a little wary of how well it would work. I ended up experiencing my normal ovulation symptoms as well, which made me even more worried as this pill is supposed to prevent ovulation. I didn&#039;t experience any side effects (no headaches, nausea, etc), but I did have some cramping that began about four days after I took it, and continued off and on for about a week. My period ended up coming today, which is three days before I expected it. Give it time and try not to worry!""",3-Oct-17,2,Moderate Side Effects,5
58432,Fluticasone / salmeterol,"Asthma, Maintenance","""Advair gave me hypertension.""",31-Oct-09,23,Extremely Severe Side Effects,5
84145,Ethinyl estradiol / norgestimate,Birth Control,"""Took pill for full year. Breasts were sore everyday, gained 20 pounds, cried over everything, nothing good happened except I didn&#039;t get pregnant.""",10-May-17,6,Mild Side Effects,5
209983,Linagliptin,"Diabetes, Type 2","""I take metformin/glipizide and my doctor added tradjenta 5mg. I took it and within an hour I was dizzy, had bad headache for over 12 hours, back pain and nausea. It did lower my blood sugar a little but these side effects were overwhelming. Not going to continue with this medication.""",5-Oct-16,15,Mild Side Effects,2
13974,Bydureon,"Diabetes, Type 2","""Use it and love the results""",10-Mar-14,31,No Side Effects,2
46327,Modafinil,Hypersomnia,"""Before this medicine I always felt tired , irrated by little things,and sometime felt emotionless because of how tired I was I went to my neurologist was diagnosed with ideopathic hypersomnia which means when I sleep I guess I don&#039;t really sleep. All I know is I have a New perspective on life knowing there was something wrong with me and now this medicine controls it and makes me feel so much more awake and be just like anyone else that does not have this disorder I learned the hard way one day what will happen if I stop taking it. I will go back to my old depressed tired self""",1-Mar-15,10,No Side Effects,5
9129,Cefuroxime,Sinusitis,"""I am a chronic sinusitis sufferer and normally I let it play out and my body will usually fight it off but every now and then I have to get antibiotics, usually once a year and twice on rare occasions. It usually takes anywhere from 5-7 Days before I get any relief well this time I went in because my tongue seemed cut and burning and throat was a little sore but I wasn&#039;t suffering from the normal sinus pressure and headaches but was told infection had spread to my ears and throat and was put on cefuroxime 500mg twice daily and though my tongue is still sore it seems to be healing ok and my throat and ears are no longer sore ears are plugged a bit though. I breathe better through my nose. I have not experienced the taste as my pills are coated.""",11-Nov-11,37,Mild Side Effects,5
39030,Contrave,Weight Loss,"""I am 2 days into week 3. I have had zero side effects but I&#039;ve had 0 weight-loss and no loss of appetite. I don&#039;t know what I&#039;m doing wrong. Any suggestions?""",13-Jul-17,5,Mild Side Effects,5
200064,Varenicline,Smoking Cessation,"""I quit smoking with chantix ! If it wasn&#039;t for chantix I never would of been able to quit !! I loved smoking and and did it for 35 years ! I knew it was time to quit but I also knew I needed help then I heard about chantix ! Started taking it and set my quit day and I did it I didn&#039;t have bad cravings and it wasn&#039;t hard at all I couldn&#039;t believe it ! To my amazement I really can&#039;t say enough about chantix its great. It&#039;s now been over a year now and I am now a nonsmoker yay to chantix""",17-Oct-15,22,Severe Side Effects,5
71238,Lysteda,Menorrhagia,"""Within 20 minutes of taking this medication one side of my body became numb, I got really confused, and felt like I could not talk and then I lost consciousness briefly. It was the closest thing I can imagine to a stroke, and the after effects from this very scary experience lasted for days. I was told to discontinue immediately.""",7-Sep-16,28,Mild Side Effects,5
118789,Zoloft,Depression,"""I was suffering from depression and anxiety for as long as I could remember, but never sought treatment. My family has always been against relying on any sort of psychiatric drugs and believe in willpower as a medicine. Eventually, my condition got so bad, that I knew I had to do something about it. Zoloft saved my life! I feel like myself again and my rationality and naturally positive outlook have returned to me. Plus I haven&#039;t gained a pound! The only really negative side effect is reduced sex drive. This can also be due to hormonal birth control. I have also had very vivid dreams since going on Zoloft (50mg). That, I&#039;m not complaining about. Amazing medication!""",8-Mar-12,35,Mild Side Effects,5
175397,Scopolamine,Motion Sickness,"""Have  to take this when I am on cruises or would have motion sickness. 1st 5 yrs I took this no prob. The 6th cruise   my throat closed up and could hardly swallow while eating.  It dawned on me to try prilosec.  It enabled me to swallow.  This has happened the last 5 years over a 5 year stretch of cruises.""",2-Oct-17,2,No Side Effects,4
143512,Etonogestrel,Birth Control,"""I&#039;ve been on Nexplanon for about 2 and a half years. I have had nothing but problems with this thing. I have uncontrollable mood swings. Which isn&#039;t me at all. I get angry over the smallest things. I&#039;ve had more UTI&#039;s which were unknown to me before being on this. I overall would not recommend this to anyone unless you can deal with extreme mood swings and other health related issues.""",5-Jan-17,2,Mild Side Effects,5
12362,Atripla,HIV Infection,"""I was admitted to hospital in march 2011, my viral load was 1,730,000.00 (yep million) and CD4 count 30. I also had cryptococcal and was in a bad state. My Doctor prescribed Atripla after cryptococcal was bought under control, within 2 months, dropping my viral load to 300 and upping my CD4 to 135, I was feeling better than ever, with more energy.""",2-Aug-11,6,Moderate Side Effects,5
217901,Strattera,ADHD,"""I got way to many mental and physical negative side effects and it didn&#039;t seem to help that much. Although at times I felt I could pay attention better. I was only on 10mg. My doctor told me to stop taking it and now I have to see a psychiatrist.""",28-May-09,12,Moderate Side Effects,1
138576,Phentermine,Weight Loss,"""I agree, the best medical weight loss pill out on the market. What made me feel safe was knowing its been around, FDA approved for 60 years. I&#039;ve been on phentermine for a month and a half now and already reached my goal of 135. I lost a total of 20 pounds! I recommend to anyone wanting to lose weight fast.""",14-Mar-13,42,Mild Side Effects,5
221581,Ziana,Acne,"""DO NOT USE THIS PRODUCT!!! It made me breakout like never before. I had barely any acne before i began this product, but wanted to get rid of my occasional pimple for good. My dermatologist prescribed me this and i used it for a little over a week. My face has never been so dry, irritated, and worst of all, covered in acne. I had a huge breakout on my chin and yes this may just be the initital purge, but it ruins your skin and it is hard to recover from this. I was so depressed during this week and actually felt like a worthless human being because my face looked so bad. Dont trust these harsh skin products!!!""",5-May-16,5,Mild Side Effects,5
219782,Amitriptyline,ibromyalgia,"""I am using trypiyizole  10 mg for around 12 years to treat fibromylagia and I feel very happy 
With the improvement .I can say that it is a miracle drug ,also it did not cause any side effects
Though it is an old generation drug but it is much effective .""",3-Aug-17,10,Mild Side Effects,1
212583,Veramyst,Rhinitis,"""I&#039;ve taken Veramyst for 11 days. My cavity fluid was &quot;moderate.&quot; In one week the fluid was reduced to &quot;small.&quot; A moderate amount of fluid is very uncomfortable to me, with shortness of breath and sinking oxygen level. Blood oxygen went from 91% to 96% in that first week of using Veramyst. It&#039;s now at 98%. A huge difference to me in how I feel with the moderate amount of fluid to the small amount. No side effects noted.""",3-Oct-08,23,No Side Effects,5
13274,Amphetamine / dextroamphetamine,ADHD,"""I have  been diagnosed with ADD . I have always pushed myself to get good grades and to take as many AP and honors classes as I can handle. I enjoy learning about new things; however, my lack of focus got in the way of my learning. It bothers me when people say ADD/ADHD is made up. I know that people who don&#039;t have this disorder can&#039;t truly understand what it&#039;s like. Without adderall my mind is foggy and I can&#039;t take the fog away to learn about the things that I love. All my friends know that I have a strong passion for physics and astronomy, but it&#039;s very hard for me to pick up a book without forgetting most of what I read after I finished it. On adderall I feel like the fog fades always and my mind is like a clear sunny day. Oh how I wish that I didn&#039;t have to take this every day and just naturally be as focused. I am just an 18 year old who is trying to pursue her dreams, but without this medication I&#039;m not sure how I can get through college to learn what I love. I can now look through my telescope at the stars without the clouds getting in the way.""",6-May-17,66,Moderate Side Effects,1
170156,Quetiapine,Generalized Anxiety Disorde,"""Seroquel is like the silver bullet. It not only relieved me of my anxiety, it also makes me feel positive, serene and generally in a good mood! I am on 125 mg at night. I was on 100mg but went off to try Risperidone ( to try to help with the weight gain). Risperidone was not nearly as effective for me as Seroquel so I went back on but 100 mg wasn&#039;t enough so I upped it to 125mg and I am back to feeling great!

I have had weight gain but I feel so much better being on Serequel. My doctor recommended I cut out carbs and sugar. When I did cut out carbs and sugar I did loose weight but it is difficult for me to stick with.""",27-Mar-17,25,Mild Side Effects,5
163445,Methylphenidate,ADHD,"""This drug has cause way to many side effects on my 12 year old grandchild. Has cause her body to over develop very fast.""",20-May-17,11,Severe Side Effects,1
99724,Magnesium sulfate / potassium sulfate / sodium sulfate,Bowel Preparation,"""Wasn&#039;t that bad. It&#039;s my first time getting a colonoscopy at 20 years old and I was both pleasantly surprised and horribly disappointed. The taste is bad but not terrible - definitely like salty grape or cherry cough syrup. I had a harder time getting down the water after the actual medicine because it made me so nauseous. I had really terrible shakes and chills but it passed within the first hour, along with the cramping and the nausea. I would stay on the toilet if I were you and definitely keep wet wipes handy. After the initial symptoms it was really easy to deal with, I would recommend it.""",7-Oct-16,13,Extremely Severe Side Effects,5
211816,Lamotrigine,Bipolar Disorde,"""This drug is a god send I suffered from bipolar since I was 17 im now 21 I have mixed episode that last for 6 month or more. I tried evey single medicine and I mean every thing antidepressant make me worse I have panic attack, fears ,alot of tears, a lot of depression, obsessive songs in my head lol and nothing seems to work like this one. I left all other drugs (not cold turkey ) , and started it and within 2 weeks I got normal - no panic, no depression and of course no hypomanic no side effect at all , this drug saved I&#039;m more stable focused try it if you are bipolar 2 its a game changer""",21-Sep-16,60,Mild Side Effects,3
137439,Isotretinoin,Acne,"""This was the only drug that ever cleared up the horrible acne problem I had with minimal side effects which included dry sinuses (bleeding from nose), VERY dry lips, easily sunburned, and some other minor irritation but that was all worth it for clearing up the horrible acne I had and changing my life forever as it did!""",3-Dec-09,12,Extremely Severe Side Effects,5
182087,Micardis HCT,High Blood Pressure,"""I find that the medication works very well and have had little side effects until I was out in the sun for an extended period of time and fainted.  Have never fainted before and attributed it to dehydration.  Drink lots of water!""",10-Dec-09,15,No Side Effects,4
38171,Albuterol,Bronchospasm Prophylaxis,"""Albuterol tablet has serious side effects. I have been trembling, extremely tired, muscle weakness, unsettled and completely abnormal feeling for 24 hours. I had to take off work today due to Side Effects Not my initial ailment! Please be careful prescribing this Docs.""",12-Nov-15,1,Mild Side Effects,5
224770,Bupropion,Depression,"""Dude... OK... I&#039;ve only been taking this a few days and my Dr is starting me on a low dose of 150mg... But I just needed to say something about how I feel.
I struggle with depression and ADD... I struggle with impulsive masochistic behavior when going through a tough time... Like binge eating etc.
Today....... I felt calm. Pleasantly neutral happy and calm... A little foggy headed, tired and quiet and *tiny* headache... But it was amazing to not feel the intense emotions. I had some coffee and then I really got some housework done for the first time in weeks.
I hope that this helps me lose weight... Not just by curbing appetite but because I&#039;ll be less prone to the emotions that drive me to binge. I&#039;m HOPEFUL. We&#039;ll see how it goes!""",5-Aug-17,16,Mild Side Effects,5
